{
  "schema_version": "phase_mapping.v1",
  "head_commit": "c034cfee2be6d3131d155215572e8e42dd1bab01",
  "created_at": "2026-03-05T17:50:45Z",
  "story_id": "S2-001",
  "mappings": [
    {
      "finding_id": "CODEX-ENRICHED-BUNDLE",
      "tool": "codex",
      "prompt_style": "enriched",
      "maps_to": "gap_id",
      "gap_id": "GAP-S2-001-EXTERNAL-BLOCKING-PROOF",
      "justification": "Includes blocking findings (P0/P1) on AT ownership/proof causality and contract alignment; mapped to blocking proof cluster."
    },
    {
      "finding_id": "CODEX-GENERIC-BUNDLE",
      "tool": "codex",
      "prompt_style": "generic",
      "maps_to": "gap_id",
      "gap_id": "GAP-S2-001-EXTERNAL-HASH-CANONICALIZATION",
      "justification": "Mapped to same hardening cluster; findings overlap enriched concerns on identity canonicalization and fail-closed validation."
    },
    {
      "finding_id": "KIMI-ENRICHED-BUNDLE",
      "tool": "kimi",
      "prompt_style": "enriched",
      "maps_to": "gap_id",
      "gap_id": "GAP-S2-001-EXTERNAL-PROOF-COVERAGE",
      "justification": "Mapped to proof coverage hardening cluster (AT proof completeness and test-scope concerns)."
    },
    {
      "finding_id": "KIMI-GENERIC-BUNDLE",
      "tool": "kimi",
      "prompt_style": "generic",
      "maps_to": "gap_id",
      "gap_id": "GAP-S2-001-EXTERNAL-HASH-CANONICALIZATION",
      "justification": "Mapped to canonicalization hardening cluster for additional medium-severity checks."
    },
    {
      "finding_id": "GEMINI-ENRICHED-BUNDLE",
      "tool": "gemini",
      "prompt_style": "enriched",
      "maps_to": "gap_id",
      "gap_id": "GAP-S2-001-EXTERNAL-BLOCKING-PROOF",
      "justification": "Includes blocking findings (P0/P1) on AT proof validity and hash collision risk; explicitly mapped to blocking proof-hardening cluster."
    },
    {
      "finding_id": "GEMINI-GENERIC-BUNDLE",
      "tool": "gemini",
      "prompt_style": "generic",
      "maps_to": "gap_id",
      "gap_id": "GAP-S2-001-EXTERNAL-HASH-CANONICALIZATION",
      "justification": "Mapped to canonicalization cluster; confirms delimiter/normalization risk with additional evidence."
    },
    {
      "finding_id": "OPUS-ENRICHED-BUNDLE",
      "tool": "opus",
      "prompt_style": "enriched",
      "maps_to": "gap_id",
      "gap_id": "GAP-S2-001-EXTERNAL-PROOF-COVERAGE",
      "justification": "Mapped to proof coverage cluster (golden-vector anchoring and AT ownership/proof-chain consistency concerns)."
    },
    {
      "finding_id": "OPUS-GENERIC-BUNDLE",
      "tool": "opus",
      "prompt_style": "generic",
      "maps_to": "gap_id",
      "gap_id": "GAP-S2-001-EXTERNAL-PROOF-COVERAGE",
      "justification": "Mapped to proof coverage cluster (missing hardcoded vectors and tautological-proof test patterns)."
    }
  ],
  "unmapped_count": 0,
  "unmapped_p0_p1_count": 0
}
